{
  "schemaVersion": 1,
  "authority": "generated-from-src-app-api-route-ts",
  "methods": [
    "POST",
    "PUT",
    "PATCH",
    "DELETE"
  ],
  "totals": {
    "routeFiles": 92,
    "mutatingOperations": 69,
    "activeOperations": 65,
    "denyOnlyOperations": 4,
    "operationsWithFindings": 55,
    "findings": 75,
    "findingCounts": {
      "missing_audit_or_observability_evidence": 3,
      "parsed_body_without_size_limit": 48,
      "replayable_command_without_idempotency": 5,
      "required_strict_revocation_missing": 19
    }
  },
  "routes": [
    {
      "route": "/api/academy-auth",
      "method": "DELETE",
      "sourcePath": "src/app/api/academy-auth/route.ts",
      "sourceHash": "5d445a69802a71c980fdd71a",
      "delegatedTo": null,
      "delegatedSourceHash": null,
      "mutationMode": "active",
      "classification": "authenticated",
      "principalSource": "verifyUnifiedSession",
      "tenantSource": null,
      "risk": [
        "credential"
      ],
      "controls": {
        "csrf": true,
        "strictRevocation": true,
        "rateLimit": false,
        "rateLimitNamespace": null,
        "expectsBody": false,
        "bodySizeLimit": false,
        "contentTypeCheck": false,
        "inputParser": null,
        "idempotency": false,
        "transaction": false,
        "verifiedPrincipal": true,
        "tenantFromVerifiedContext": false,
        "noStore": true,
        "audit": true,
        "redaction": true,
        "failClosed": true,
        "serviceIdentity": false,
        "setsCookie": false,
        "explicitPublicCachePolicy": false,
        "headerBodySizeHint": false,
        "bodySizeLimitAuthority": null
      },
      "domainOwner": "academy-auth",
      "testReferences": [
        "src/tests/security/auth-logout-route-postgres.test.ts"
      ],
      "requirements": {
        "csrf": true,
        "strictRevocation": true,
        "rateLimit": false,
        "bodySizeLimit": false,
        "idempotency": false,
        "verifiedPrincipal": true,
        "noStore": true,
        "audit": true,
        "redaction": true,
        "serviceIdentity": false
      },
      "findings": [],
      "evidenceSource": {
        "sourcePath": "src/app/api/academy-auth/route.ts",
        "method": "DELETE",
        "resolved": true
      }
    },
    {
      "route": "/api/academy-auth",
      "method": "POST",
      "sourcePath": "src/app/api/academy-auth/route.ts",
      "sourceHash": "5d445a69802a71c980fdd71a",
      "delegatedTo": null,
      "delegatedSourceHash": null,
      "mutationMode": "active",
      "classification": "public",
      "principalSource": null,
      "tenantSource": null,
      "risk": [
        "credential"
      ],
      "controls": {
        "csrf": true,
        "strictRevocation": false,
        "rateLimit": true,
        "rateLimitNamespace": "academy-auth",
        "expectsBody": true,
        "bodySizeLimit": false,
        "contentTypeCheck": false,
        "inputParser": "json",
        "idempotency": false,
        "transaction": true,
        "verifiedPrincipal": false,
        "tenantFromVerifiedContext": false,
        "noStore": true,
        "audit": true,
        "redaction": true,
        "failClosed": true,
        "serviceIdentity": false,
        "setsCookie": true,
        "explicitPublicCachePolicy": false,
        "headerBodySizeHint": false,
        "bodySizeLimitAuthority": null
      },
      "domainOwner": "academy-auth",
      "testReferences": [
        "src/tests/security/auth-logout-route-postgres.test.ts"
      ],
      "requirements": {
        "csrf": true,
        "strictRevocation": false,
        "rateLimit": false,
        "bodySizeLimit": true,
        "idempotency": false,
        "verifiedPrincipal": false,
        "noStore": true,
        "audit": true,
        "redaction": true,
        "serviceIdentity": false
      },
      "findings": [
        "parsed_body_without_size_limit"
      ],
      "evidenceSource": {
        "sourcePath": "src/app/api/academy-auth/route.ts",
        "method": "POST",
        "resolved": true
      },
      "operationOverride": {
        "authorityType": "pre-authentication",
        "reason": "Login and signup create the first authenticated session; no prior session exists to revoke-check.",
        "issue": "#108"
      }
    },
    {
      "route": "/api/academy-certificates",
      "method": "POST",
      "sourcePath": "src/app/api/academy-certificates/route.ts",
      "sourceHash": "a742205a40bdac41bdb4fedc",
      "delegatedTo": null,
      "delegatedSourceHash": null,
      "mutationMode": "active",
      "classification": "authenticated",
      "principalSource": "getStudentSessionFromRequest",
      "tenantSource": null,
      "risk": [
        "progress"
      ],
      "controls": {
        "csrf": true,
        "strictRevocation": false,
        "rateLimit": true,
        "rateLimitNamespace": "academy-certificates-issue",
        "expectsBody": true,
        "bodySizeLimit": false,
        "contentTypeCheck": false,
        "inputParser": "json",
        "idempotency": false,
        "transaction": true,
        "verifiedPrincipal": true,
        "tenantFromVerifiedContext": false,
        "noStore": true,
        "audit": true,
        "redaction": true,
        "failClosed": true,
        "serviceIdentity": false,
        "setsCookie": false,
        "explicitPublicCachePolicy": false,
        "headerBodySizeHint": false,
        "bodySizeLimitAuthority": null
      },
      "domainOwner": "academy-certificates",
      "testReferences": [],
      "requirements": {
        "csrf": true,
        "strictRevocation": false,
        "rateLimit": false,
        "bodySizeLimit": true,
        "idempotency": false,
        "verifiedPrincipal": true,
        "noStore": true,
        "audit": false,
        "redaction": true,
        "serviceIdentity": false
      },
      "findings": [
        "parsed_body_without_size_limit"
      ],
      "evidenceSource": {
        "sourcePath": "src/app/api/academy-certificates/route.ts",
        "method": "POST",
        "resolved": true
      }
    },
    {
      "route": "/api/academy-flashcards",
      "method": "PUT",
      "sourcePath": "src/app/api/academy-flashcards/route.ts",
      "sourceHash": "cd1436e2124eff8dbe3e0e13",
      "delegatedTo": null,
      "delegatedSourceHash": null,
      "mutationMode": "active",
      "classification": "authenticated",
      "principalSource": "getCanonicalSession",
      "tenantSource": null,
      "risk": [],
      "controls": {
        "csrf": true,
        "strictRevocation": true,
        "rateLimit": true,
        "rateLimitNamespace": "academy-flashcards-write",
        "expectsBody": true,
        "bodySizeLimit": false,
        "contentTypeCheck": false,
        "inputParser": "json",
        "idempotency": false,
        "transaction": true,
        "verifiedPrincipal": true,
        "tenantFromVerifiedContext": false,
        "noStore": true,
        "audit": true,
        "redaction": true,
        "failClosed": true,
        "serviceIdentity": false,
        "setsCookie": false,
        "explicitPublicCachePolicy": false,
        "headerBodySizeHint": true,
        "bodySizeLimitAuthority": null
      },
      "domainOwner": "academy-flashcards",
      "testReferences": [],
      "requirements": {
        "csrf": true,
        "strictRevocation": false,
        "rateLimit": false,
        "bodySizeLimit": true,
        "idempotency": false,
        "verifiedPrincipal": true,
        "noStore": true,
        "audit": false,
        "redaction": true,
        "serviceIdentity": false
      },
      "findings": [
        "parsed_body_without_size_limit"
      ],
      "evidenceSource": {
        "sourcePath": "src/app/api/academy-flashcards/route.ts",
        "method": "PUT",
        "resolved": true
      }
    },
    {
      "route": "/api/academy-lead",
      "method": "POST",
      "sourcePath": "src/app/api/academy-lead/route.ts",
      "sourceHash": "3732c40ddbb8ed32c0520dac",
      "delegatedTo": null,
      "delegatedSourceHash": null,
      "mutationMode": "active",
      "classification": "public",
      "principalSource": null,
      "tenantSource": null,
      "risk": [
        "privacy"
      ],
      "controls": {
        "csrf": true,
        "strictRevocation": false,
        "rateLimit": true,
        "rateLimitNamespace": "academy-lead",
        "expectsBody": true,
        "bodySizeLimit": false,
        "contentTypeCheck": false,
        "inputParser": "text",
        "idempotency": true,
        "transaction": false,
        "verifiedPrincipal": false,
        "tenantFromVerifiedContext": false,
        "noStore": true,
        "audit": true,
        "redaction": true,
        "failClosed": true,
        "serviceIdentity": false,
        "setsCookie": true,
        "explicitPublicCachePolicy": false,
        "headerBodySizeHint": false,
        "bodySizeLimitAuthority": null
      },
      "domainOwner": "academy-lead",
      "testReferences": [
        "src/tests/security/crm-lead-security.test.ts"
      ],
      "requirements": {
        "csrf": true,
        "strictRevocation": false,
        "rateLimit": true,
        "bodySizeLimit": true,
        "idempotency": false,
        "verifiedPrincipal": false,
        "noStore": true,
        "audit": true,
        "redaction": true,
        "serviceIdentity": false
      },
      "findings": [
        "parsed_body_without_size_limit"
      ],
      "evidenceSource": {
        "sourcePath": "src/app/api/academy-lead/route.ts",
        "method": "POST",
        "resolved": true
      }
    },
    {
      "route": "/api/academy-lesson-assessment",
      "method": "POST",
      "sourcePath": "src/app/api/academy-lesson-assessment/route.ts",
      "sourceHash": "c46ad506b94459c30ba97c99",
      "delegatedTo": null,
      "delegatedSourceHash": null,
      "mutationMode": "active",